topAI_name,topAI_name_url,topAI_what_is,topAI_tag,topAI_price,topAI_link_url
Kome,https://topai.tools/t/kome,Kome is an all-in-one AI-powered bookmark extension that enhances your online browsing experience. W..,Summarizer Productivity,Freemium,https://kome.ai/?ref=topaitools
HeyLibby,https://topai.tools/t/heylibby-ai,HeyLibby.ai is an AI tool that helps you streamline your lead generation and lead management process..,Sales Business,Free,https://heylibby.ai/?ref=topaitools
B2BRocket,https://topai.tools/t/b2brocket-ai,B2B Rocket AI is an innovative AI tool designed to boost the B2B sales process. B2B Rocket AI's prop..,Sales Business,Subscription,https://www.b2brocket.ai/?ref=topaitools
WPTurbo,https://topai.tools/t/wpturbo-dev,WPTurbo gathers WordPress development tools to help website creators to ship them faster. The main t..,Developer tools Wordpress,Freemium,https://wpturbo.dev/?ref=topaitools
BrainyPDF,https://topai.tools/t/brainypdf,"BrainyPDF is an AI tool that helps you chat with any PDF document. It allows students, researchers, ..",Chat Document Search,Free,https://brainypdf.com/?ref=topaitools
InterviewAI,https://topai.tools/t/interviewai,InterviewAI is an AI-powered platform that revolutionizes the interview process. With its real-time ..,Human resources,,https://www.interviewai.io/?ref=topaitools
Machined.ai,https://topai.tools/t/machined-ai,Machined.ai is an AI-powered tool that automates the process of building content clusters. With just..,Content creation SEO,Free trial,https://machined.ai/?ref=topaitools
MyShell,https://topai.tools/t/myshell,MyShell is an innovative chatbot platform that allows you to create personalized chatbots called She..,Chatbots,Usage based,https://myshell.ai/?ref=topaitools
mst.ai,https://topai.tools/t/mst-ai,Ministerai is a free online AI art generator that allows you to unleash the power of your imaginatio..,Art Generation Image Generation,Free,https://mst.ai/?ref=topaitools
Zentask,https://topai.tools/t/zentask,Zentask is an AI-powered solution that simplifies work and boosts productivity. It offers a range of..,Content Creation Productivity,Freemium,https://zentask.ai/?ref=topaitools
Copilot2trip.com,https://topai.tools/t/copilot2trip-com,Copilot2trip is an AI-powered personal travel assistant that helps you plan your trips with ease. Wi..,Travel Life Assistant,Freemium,https://copilot2trip.com/?ref=topaitools
RizeMail,https://topai.tools/t/rizemail-app,Rizemail summarizes your emails without you having to leave your inbox. No installs. For free. You s..,Email Productivity,Free,https://www.rizemail.app/?ref=topaitools
ProAI Image Generator,https://topai.tools/t/proai-image-generator,"ProAI is an AI image and art generator, that can be used to generate free images, with different use..",Image Generation Art Generation,Freemium,https://thetubepro.com/proai-image-generator/?ref=topaitools
GenixGPT - Travel AI,https://topai.tools/t/genixgpt-travel-ai,GenixGPT is an AI travel planner that helps you discover the best hidden gems and off-the-beaten-pat..,Travel Life Assistant,Free trial,https://www.genixgpt.com/?ref=topaitools
Coginiti,https://topai.tools/t/coginiti-co,Coginiti AI is an AI data analytics assistant that helps users produce consistent high-quality insig..,Data analysis Business,Free trial,https://www.coginiti.co/ai-analytics-advisor/?ref=topaitools
Everbility,https://topai.tools/t/everbility,Everbility is an AI-powered documentation assistant designed specifically for occupational therapist..,AI Assistant,Freemium,https://www.everbility.com/?ref=topaitools
TextLayer,https://topai.tools/t/textlayer,Textlayer is an AI-powered research companion that simplifies access to the latest research and mach..,Research,Freemium,https://textlayer.ai/?ref=topaitools
Chat2CSV,https://topai.tools/t/chat2csv,Chat2CSV will help you chat with your CSV files in natural language. Transform your data into charts..,Data analysis,Freemium,https://chat2csv.com/?ref=topaitools
